Message,Availability,Payment,Attraction (Experiences),Facility,House Rules,Location,Discount,Contact Host,Others
"Hello, I am looking for a house from Dec 27 and Jan 02 with my family. We are 6 adults and 4 kids. I would like to understand if you have cleaning included every day in the price and if you would prepare the breakfast. We are a very going from Chile and Brazil to spend the week in Miami together. Looking forward to hear from you and also confirm the availability. Thank you. Priscila",1,,,,1,,,,
hi! this is ms. nancy guevarra. we are very interested in renting your beautiful apartment from september 15 to september 19. if it is available by those dates please contact me via mobile at +-- ---- ----.,1,,,,,,,,
"Hi there!I saw your ad about the short stay apartment in Melbourne, and I was just wondering, am I renting a whole apartment, or just the room in an apartment shared with someone else?",,,,,1,,,,
"Hi, we are 6 people looking for a place to stay when we visit Japan.And your place looks amazing!We are from Norway between the ages 23-28.We are thinking of booking this place after we buy plane tickets which will happen in Desember.The booking date we are looking for are +-- ---- ----.Can you tell us more about how payment works? (When do we pay, How do we pay, do we pay it all in one bulk, are the total price 4,300 usd or will there be additional fees??)RegardsChristian Nilsen",1,1,,,,,,,
"Good morning, I like to rent for a short term till 15aug. Thanks.",1,,,,,,,,
"I would like to inquiry about able to allow us to check out at 1pm instead of 12pm, because we have a class in town till 12.00pm on 16/8/2015, therefore, we cant coming back ontime for check out at 12pm. Awaiting for your sooner reply! Thanks.",,,,,1,,,,
Hi.. On this date your property available?,1,,,,,,,,
"Hola,My husband and I are looking for accommodation in the Puerto Morelos area for two weeks. We are hoping to escape this Canadian winter the end of January or the beginning of February. Please let me know if you have accommodation available.Thanks,Nancy",1,,,,,,,,
"Hi. My wife and I will be travelling around Asia for holiday, and will be staying in Singapore for one night for transit. Would the studio be available for 13th Feb 2016? Thank you in advance for your assistanceFerry",1,,,,,,,,
My grandpa is going to be receiving treatment at MD Anderson. He is staying at the rotary house. I need a condo that sleeps 2 but prefer separate beds. I believe that we will check in Friday. Can you please tell me about your condo and does the couch pull out?,,,,1,1,,,,
"Dear Owner,I am very interested in your property.However please will you confirm how many bedrooms it has.The description says 1 but the photos appear to show 2I look forward to hearing from you.Bet wishesJulia Yardley",,,,1,,,,,
Can u confirm if this is available for the given dates & the total costs in AUD$ Is it also available if we need to extend it 1-2 weeks extra?Thanks Liz,1,1,,,1,,,,
Is the price not 51$? When I try to book it becomes 57$ per night. There is another person comin in 22nd of January is it possible to pay the additional 11$ fee ehen he comes,,1,,,,,,,
"Hi,We are two families with small children (age 3 to 5) looking for a house for rent in july.Your house looks like what we are looking for, and I have a few questions: - is the house close to a beach. With small children it is better to be able to walk into the water.- is there a swimming pool in a walking distance that we can use? In a hotel or similar.- is there restaurants, shops etc in the area?Thank you in advance for your reply.Kind regardsBarbro Endresen",,,1,1,,,,,
We have two dogs. Will that work?Stan Wilson,,,,,1,,,,
"My Name is Bei,we are going to Japan from 3-12 to -------.--- and My boyfriend and two of my teens.I would like to book your apartment from 3-12 to 3-17 and then 3-21 to 3-23.can you send me more info and how the payment works? few questions I would like to know the pocket wifi included to the room rental? is any other fees we need to know ahead time? we will go kyoto for 3 days . if I book from 3/12 to 3/23 the whole time will you offer discount for us?Thank you very much!Bei",1,1,,,,,1,,
"Hi My family and I are from Brazil, and ew will spend some time in Seoul, from 27-september to 4-april-16.I will work in an engineering company in Seoul.I saw the description of your apartment, and like it very much,.I would like to know some points:How can we do the rental contract?How is the payment of the reservation and the rental?For these whole period, is the apartment available and how much is going to be the monthly payment?Best regards.Mr. Ricardo",1,1,,,,,,,
"We are arriving 7 AM at TXL, so is there a place at your building we can store our luggage before we check in?",,,,,1,,,,
Please send me the exact address,,,,,,1,,,
"I m a Singaporean n m looking for a temporary lodging cos my son DIL is giving birth to her 3rd baby, so I hv to get a place for the time being. do get bk to me asap. TQ",1,,,,,,,,
"hello,can you give me a quote of this 2 days? thank you",,1,,,,,,,
Is there any for rent in sembawang for 10 days only?,1,,,,,,,,
Hi. Can you call me for faster transaction? Thanks+-- ---- ---- - James,,,,,,,,1,
We are going to Japan soon. We are interested in your property for rental. We have two adults and three children in our family. What is your best rate?,,,,,,,1,,
"Hi Muno,Can I check if I can rent the villa for one night? 15th August to 16th August?Thanks,Ne.",1,,,,,,,,
"hi ive tried to contact you through -------, is this villa still available?",1,,,,,,,,
"I am looking at your place from 2016-03-14 to 24. Can you confirm availability and price?I am just wondering about the pool facilities, as it is not clear in the picture. Can you guide me to other pictures or let me know more about the pool? Thanks.Thank you very much.",1,1,,1,,,,,
Hello. Is this available from 25-27 March 2016? I can be contacted at +-- ---- ----,1,,,,,,,,
"Hi i Siew Fong from Singapore. I am interested in booking your apartment, however is it possible to check in earlier? Because I will be checking out from Kyoto early in the afternoon, i will reach Osaka at around 3pm. Thank you (:",,,,,1,,,,
"Hi, i am from Singapore. My colleagues and i will be having our attachment at Hammondcare and POW hospital on the above dates. is the above dates available?Hope to see hear from u soon.",1,,,,,,,,
I would like to rent here one night. It's all the girls reunited before we go back to school and travel back home. We are thinking of this area since it is in the middle for all of us. Most vacation houses are either booked or have to be shared with other local/tourists which is not in our interest. I am ready to pay as soon as we speak. -Julia H. +-- ---- ----,1,,,,,,,,
hi niaz. im just wondering about the cleaning fee. is it compulsory?,,1,,,,,,,
"Hello Nobu San, Nice to contact with you ! I have some questions for booking : 1) please help double confirm the captioned duration is available (18th - 22nd Nov, 2015). 2) please advise the closest station (which line and station name) from your apartment. Thank you ! B RgdsGladys",1,,1,,,,,,
Please give us the apartment address and let us know the availability. We schedule to arrive on 14 feb'16 at 10 a.m. Thanks,1,,,,,1,,,
"Hi, were planning to go to singapore on feb.we are 8 adults and 3 toddlers , but they're co sleepingbwith us. could you accomodate us? thanks",1,,,,,,,,
"I am wondering if this property is available for the dates above, please let me know asap",1,,,,,,,,
contact me as soon as possible,,,,,,,,1,
"will like to find out the dates you have available for your apartment? My husband who is a foreigner and I are looking for somewhere to call our own for a month. We have been seperated for 2 years, hence we are using this chance to finally get together for awhile. I am extremely interested in your listing. I am really looking forward to your reply. Thank you",1,,,,,,,,
Hi thereI am very interested in your apartment. How long does it take to walk to the subway?Many thanksLianne,,,1,,,,,,
"Morning, I'm interesting to stay in your place, want to ask, how many minutes to walk from Somerset MRT?And Where is the exactly ur place?Hopefully get information from u soon.",,,1,,,1,,,
"Hello,we plan to visit Goa from 28 Jan 2016 till 1 Feb 2016. We are a family of 6 adults and a child aged 3 yrs.pls let us know the availability of your place with charges.Thank youAlmira DSouza",1,1,,,,,,,
"Hi! I am interested in renting your property for 5 nights however before I go ahead with the booking I would have some few questions:1. Do you provide clean bed sheets and towels for the guests?2. Do you have internet connection?3. Is there someone who will clean the house everyday while we're away? Hope to hear from you soon.Regards,Arriane",,,,1,1,,,,
Hi as u can c I'm after a clean relaxing 2 bedroom villa in seminak in August Regards Barbara,1,,,,,,,,
"Hi, Nobui am from ibaraki ken and my name is gayan.. so we planing to go to osaka next month for a 3 days, we interest your apartment. can you explain me about Additional Guest Fee please and 87$ is not included 10 guest?thank youbest regard Gayan",,1,,,,,,,
"We are a family from Denmark who are looking for a place to stay in Sydney in early 2016. My husband and I will be working as assistant professors at University of Sydney while our children will be spending their time at the playground with our nanny, Christine. We are looking for a place to accommodate the four of us and potentially also Christine. We are quiet, considerate non-smokers. Is your place available for this period and what would the price be for three months? Best regards, Merete",1,1,,,,,,,
"Hi Hazel,Is your apartment available 28-31 May for 3 X nights?We are a family of 4, kids aged 8 & 9. I can't see your reviews are you able to send me a link?Thank youAimee",1,,,,,,,,
"Your house looks adorable. Is it close to city center or transportation to city center. I would come to visit Japan from July 25 through 8/10. Altogether the group is 2 adults, 3 teenagers. Dates are flexible as i am still planning. Do you have availability for 3 nights during this period? We are coming from NY. thanks",1,,1,,,,,,
"Hi, I am looking to book this 2 bedroom place 15-29th March. Though I am only able to a photo of 1 x double bed in 1 bedroom, are you able to share a photo of the other bedroom as I'm looking for a place for 3 x adults. ThanksSonya",,,,,1,,,,
"Hello, Im intersted to rent your unit for 3 weeks from July 15-August 6. Do you have any special price for 3 weeks? How about utilities, is it all included? How far is the condo from the greenbelt mall? Thanks.Clayde from Houston, TX",,,1,,,,1,,
"Hi,I am looking for a nice place to accommodate my guests who would be in town on account of my son's wedding.Request you for a quick revert on this.Thanks and Best Regards,Jaiwanti Shukla",1,,,,,,,,
"hello,I have 3 guests from india (parents & a son) during last 2 weeks of december for vacation to singapore.I was curious about possibly the availability of place. Looking forward to hear if so.Best Regards!Santosh",1,,,,,,,,
"Hi,We are four couples planning to visit north via from 22nd Feb to 24th Feb check out..Please share your contact details so that we can have a discussion in detail s.RegardsManoj+-- ---- ----",,,,,,,,1,
"Hello Enrico,My name's Tatiana and I'm from El Salvador. I've been living in Shanghai since March, but right now I need a 1 bedroom apartment for a month and a half. Do you have a ------- so I can contact you there? Or maybe you could add me, tatianapenate6Thank you so much!",1,,,,,,,1,
Hello,,,,,,,,,1
"I am a norwegian woman who will visit Singapore. I use a rollator and wonder how your place will be for me. Will the swimmingpool be accessible without stairs ?I am looking for a quiet, green place to stay and I think your place will be good for me. If some of the days are fully booked I am interested to stay for some days. Best regards, Hennie",1,,,1,,,,,
"Hi. We're travelling to Sydney for the long weekend, and I was just wanting to check if the apartment you have listed is still available. Best regards,Diane",1,,,,,,,,
"Hello ,This is Kapil here from -------.--- this flat available on above dates? Also is there a monthly rental rate also for this apartment ?Thanks,Kapil",1,1,,,,,,,
"Hi, my friends are interested in booking the penthouse May 11-15th. We have more than 16 people. I wanted to know if you have additional units in the same building for the extra people.",1,,,,,,,,
hi i want book above date,1,,,,,,,,
"hello I am interested in your accomodations. Is this the only one you have? can you describe it a little bit more? My wife and I are traveling to Taiwan from Honduras, Central America.",1,,,,,,,,
"Hi there :)I've been looking at a number of your listings and I don't see anywhere that there is any bond or deposit required. However, I am new to this app, so I thought I should just ask you. Do you require a deposit or bond? And if so, how much is it?Thanks in advance and I hope it's not too dumb a question :)",,1,,,,,,,
"Hi Belinda.Just want to check with u, your ""Brand new Terrace in Natural Haven"" still available for rent?TQ.",1,,,,,,,,
We want to book from 22.11.15 to 05.12.15 during study period at UNISA and will stay of 4 persons. We want to know whether it is available during that period.,1,,,,,,,,
Is this unit still available? Pls advise. So i can make reservation and payment tnx. Preferably contact me at +-- ---- ---- or +-- ---- ----. ------- is also fine. Thanks,1,,,,,,,,
"Hallo, i have plann to visit seoul on may.My aunty will be arrive at 16th may 2016 with her son and daugher. And im arrive at 17th may with my mom.So for 16th may stay for 3 person and from 17th may 2016 we're stay for 5 person. Can u give me best proce if ill stay for 6days?",,,,,,,1,,
"Hello, I wanted to check the pricing and availability for this coming September 11-16",1,1,,,,,,,
Hi just want to know housekeeping is there,,,,,1,,,,
"Could you please tell me if this apartment is available for checking in on Wednesday 14th October and checking out on Monday 19th October? If so could you quote me on a total cost including cleaning fee and ""contribution towards utilities"". Could you advise me on any other costs that we may incur and what process is used for getting the keys and for a bond to be taken.Thank you",1,1,,,,,,,
"Dear Harpal,Good Day to you.We have a female colleague from Japan who will be coming to Singapore for over a month's assignment in our HQ Office here. Hence, we are interested in your apartment for her accommodation in Singapore. However, we are wondering if you can meet up with us one of these days to show us the room first?",,,,,1,,,,
"We're a Syrian Family We're looking for a villa for our holiday we're staying in Istanbul for 22 days i was wondering if this price ""91$"" is right and if so How can i book it and where is the location..Thanks",,1,,,,1,,,
"Hi Tae, how are you?I need to visit BKK to do some annual shopping again and Dates are not confirmed at this stage which needs to be reviewed in early Jan 2016.My question is; closest BTS/MRT with approximate distance by Foot since Taxi can be more slower than BTS/MRT in BKK.I still haven't used Travelmob as yet and unsure of whole processes. Kind-regards,Hadassah.",,,1,,,,,,
"hi.. it's my first time, don't how how it really works when its last minute booking, can I rent your room for tmr? if u do pls msg me at +-- ---- ----Andi",1,,,,,,,,
"Hello,I'm planning on traveling to New York in that time frame and I liked the appartment you have for rent. I was wondering if you can tell me what's the procedure on booking and if a friend of mine can pay you in person, or it has to be online via bank?Thank you in advance.Have a good day,Ilona",,1,,,,,,,
"Dear Service i'm planning this vacation to come in NY with my family.I'd need you to confirm availability. And the last hour to check in, as we will be traveling late (23.00)",1,,,,1,,,,
"Hi,We are 2 French families : 4 adults & 4 children aged of +-- ---- ----.Do you have any accommodation and what' s the rate please ? Thank you for your answer :)Sophie",1,1,,,,,,,
"Good Afternoon, How are you? I am getting married in July and I have a lot of family coming from out of town. I'm looking from somewhere that's comfortable and affordable. I saw your listing and think it's perfect. Are the above dates available and is that the actually price or just an estimation? Also I would like to see the apartment in person if possible. I live in the neighborhood. Looking forward to hearing from you. Thank you. Jeanna Flowers",1,1,,,1,,,,
"Hi sir, may i know your contact detail for we to talk regarving our reservations? I just want to clarify some details about this...or you may contact me in +-- ---- ----...i hope we can get in touch as soon as possible before our reservation schedule... thank you and Godbless",,,,,,,,1,
"Hi there, we are a group of ladies coming to NYC to celebrate a 40TH birthday. I just wondered if you could confirm the availability of this apartment for the above dates together with the full price please.Many thanksSarah",1,1,,,,,,,
I would like to rent your. Unit for 32 dollars per night. I'm a missionary and my funds are limited. What floor is this unit on?,1,,,,,1,,,
"Hi Nilly,My name is Chris, myself and my girlfriend have lived in Bondi ( Ramsgate Ave.) for the past three years. My parents are coming to visit for the first time this February and we are looking to book accommodation for them. Your apartment looks beautiful and perfectly located.Can you kindly confirm if the unit is available from Monday 8th February until Sunday 6th March 2016?Looking forward to hearing from you.Chris",1,,,,,,,,
"Hi, I will be in the Philippines getting married in October and we are looking for somewhere to stay for 2 wks prior to the big day. Would it be possible for my fiancee to view the property prior to booking as she lives not far from your place?",,,,,1,,,,
"Hi Sir/madam,Will you stay in apartment when customer stay?Thanks.Erica Cheung",,,,,,,,,1
"Hi.. I need a Unit for my family, 6 ladies and 2 children.From 21 DecemberTo 17 JanuaryPlease let me know options and details. Thanks",1,,,,,,,,
HI there. What are the rates (50% off) or total price for above dates? Thanks!,,1,,,,,,,
"hi, is your apt available for the above dates. it stated 4 bedrooms with 2 beds? are there other beds  in the remaining bedrooms. pls reply asap as I will arrive london from kuala lumpur on 13/12 abt 10pm. payment will be online.tq",1,,,1,,,,,
"Hi we are 3 of us from jb kinda intrested in ur apartment ,we are family gonna start work 'in kl in next few day we are looking into for 1 month we are ready to pay your charges as in daily if can please do not charge us a deposit thanks and how much is the rental in local currency",,1,,,,,,,
HiDo you have availability for these dates.Thanks Steve,1,,,,,,,,
"Hi, how far is your villa to the beach ??how far to the Patong market ?is there have chef to serve the meals for the day.ThanksLee",,,1,,1,,,,
hi i am izzaty. i'm going to a holiday with my sister and my friend. i would like to know how i can make a payment and book the house? can you contact me at +-- ---- ----,,1,,,,,,1,
"We are a family of four traveling together. myself and husband, my father, and my sister. So you can guess we need a double bed, 2 single beds 0r a couch/sofa bed if possible. We arrive Singapore early morning (5:40 am) Jan 1, by air. Would be be able to check in that early? also do you have enough beds in one room for the 4 of us? thank you!!",,,,1,1,,,,
"Hi Grecia,My name is Marisa from Melbourne, Australia . My girlfriend and I are interested in your pretty villa. We were hoping it was available between 28 August to 5 September 2015. The reason for travel is to celebrate my girlfriends 50th birthday and to relax for 8 days. Would love to hear from you. Thank you Marisa.",1,,,,,,,,
"Hello, We are a American couple flying in from Macau. Would like a countdown evening at this beautiful place. - Esther",1,,,,,,,,
Hi I and my gf is going to get married next month. I am planning to bring her in with a guest.Total pax: 2 adults plus one youngster (13-14 yo)What's the best price you can offer for a 30 days stay starting from 14-Jul-2015 onwards? Or you can sms/------- me at nine-six-four-eight-eight-three-eight-nine to have a further discussion.ThanksIan Lim,,,,,,,1,1,
"Hi, do you have a 3 Bedroom Condo Unit available for rent from Dec. 19, 2015 to Jan 7, 2016? How would it be?Thank you!",1,,,,,,,,
Two women would like to reserve accommodation.The September 20 September 22 Check-in Check-out 2 nights,1,,,,,,,,
"The calendar indicates your property is vacant for the above dates and since most villas are rented months in advance will most likely not be booked during my stay in Phuket. If you will accept a last minute rate of $1,500 USD for the above dates please get back to me.Thanks for your consideration",,,,,,,1,,
"Looks like your home is available for our dates but checking to see what type of beds are in the bedrooms.Thanks,John",,,,1,,,,,
I need accomodation for my 3 guest comming from India .From 7 Aug to 10 AugI am already staying in singapore reachable at +-- ---- ---- you can whats app me as well,1,,,,,,,,
Good Evening gusto ko lang malaman kung my washing machine in your unit.,,,,1,,,,,
"Hi Kc,Can i check availability for your apartment from 25 May to 01 June.There is 14 paxs and we hopes to use your 01 unit of house.",1,,,,,,,,
"We are wondering if you would provide a reduced rate for a long term stay of 4 months. Thanks, Maddy",1,,,,,,,,
"hi, im interested but not that at price. happy to discuss",,,,,,,1,,
"Hi, i want come to hongkong at 29 Dec - 1 jan for 12 person and 1 child. and 1 jan - 2 jan for 8 persons.Can you arrange for the apartment ? Wait for your adviseThanks",1,,,,,,,,
"HiWe are a family of three (53,18, 19) and we wonder if this house is still available? Thank you for a quick response!Kind regardsMichaela",1,,,,,,,,
"Hi Ana, nice to get in touch with you right here. I would like to enquire about the villa that you are leasing out. I will travel to bali on Aug 2015 with my husband, we are newly wed couple who wanted to have our very own private time and space with no sharing of villas with others. I've noticed that most of the villas in Bali will subleased one the room from the entire villas to other travelers which they have to share the certain space like kitchen or living. I feel discomfort a bit to sharing the private space with others during our private time. By the way, I've saw the review from those stayed the villa previously mentioned that there is airport transfer service provided, may I know is there any additional charges needed for the airport transfer? Thank you. Vickie",,1,,,1,,,,
"Hi My name is Sue and I would like to travel down to Sydney from Tamworth to spend Christmas at Epping with our family. We then need to put our son and his new bride on a plane back to his new home in Sweden on Christmas day. The remainder of our family would then like to spend a couple of days in Sydney before returning home. My question is .. where would we park our cars ( 2 of them) and what proximity to the accommodation is it? thank you,Sue",,,,1,1,,,,
"hi Kim,we are a family of 3 . may i know if i could waive the additional fee for my 5 year old daughter as the 3 rd guest.we would love to stay in your place for the Christmas and New year season.",,1,,,,,,,
"Hello,We are interested in staying at your villa on the above mentioned dates.Can you please advise if it is available and what the total cost would be?Regards<Georgie",1,1,,,,,,,
HiWe are interest in your apartment for booking starting december 2 to december 12.Is it available?Regards,1,,,,,,,,
We need 2 units. Available?,1,,,,,,,,
"Hi Linda,The max occupy for this room will be 2 people?The price is included for 2 people?Alicia",,1,,,1,,,,
"Hello,Is your house available for the dates listed above. The purpose of our travel is holiday vacation. Could you confirm the total price including all fees, cleaning, and taxes in US dollars.Thank you.Eugene",1,1,,,,,,,
"Dear Ms. Josie,This is Mike Perey of Delex Pharma Int. Inc. I would like to inquire if your house for rent is still available on October 26-28, 2015? We're planning to conduct our strategic planning in a more conducive environment like your place. I am hoping to for your quick response.Mike Perey+-- ---- ---------@-----.---",1,,,,,,,,
Just checking availability and pricing for the weekend selected. Thank you .,1,1,,,,,,,
"halo, may i know the home still avilable?",1,,,,,,,,
"Hi!The design of the room is really awesome! I love it the moment I saw the pictures. :)Our 3 years old daughter will be traveling with us on this trip. We do not require an extra bed, will there be additional charges? Also, we will be going to cingjing after we check out the following day, can we deposit our luggage so at your place?We look forward to hear from you soon!:)Regards,Gillian",,1,,,1,,,,
"hi Eugene,This is Jeffrey Enriquez. I plan to bring my family to your place, Emerald Villa Private Pool Resort, tentatively 12-13 Sept. Total is 8-9 adults and 3 kids (5-6yo). I just have a few questions:1. How much is your rate per night? What's the check-in time and check-out time.2. Is your water in the pool warm (for the elders)?3. Can we cook?4. What's the exact location?Please advise. Thanks. -----@-----.---",,1,,1,1,1,,,
Guests for 10 ?,,,,,1,,,,
Hello . For a stay from dec 25th to dec 27th 2015. Accommodation for 15 people. How much will it be?,,1,,,,,,,
I want know it's can rent for months? And how much one month.,,1,,,1,,,,
