Message,Availability,Payment,Attraction (Experiences),Facility,House Rules,Location,Discount,Contact Host,Others
"i need 1 room for 6 adults 1 child with kitchenet. if not 1 room, 2 rooms also be great with side by side",,,,1,,,,,
We are traveling fr Kuala Lumpur. Propose 2 nites in Kaohsiung & 2 nites in Taipei.Is te place new? Cleanliness is very important. How convenient for sightseeing? e.g.going to nite market.Thank you,,,1,1,,,,,
"Can you contact me on my Mobile No.+-- ---- ----, i am really interested to have a look for this house for short term rental",,,,,,,,1,
"i am student here, because my apartment move in date is 16 april. if i straight rent 35days, is it possible get the discount?is it car park include?",,,,1,,,1,,
"Hello there, we just wanted to know if a booking for 4 people would secure the whole property or would we have to share with strangers? Thank you",,,,,1,,,,
"Hi,kim I'm jason from singapore. Im looking for a room for my friends from thailand for a short term visit date have been mention on the top. they are a old lady 2 mid age ladies and a baby. please contact me if im able to book at +-- ---- ---- and how come ur add say 65 yet is 90 plus",1,,,,,,,1,
"Hi Yavuz ,Were planning to have our annual vacation with my wife,is it possible on this date, what about the payment of utilities are they included on the rental fee? Can we also cook and do a laundry on your place?Regardsron",1,1,,1,,,,,
"hi - my parents (Sherry and Boyd Morgan) are arriving tonight and staying in one of the valley point apartments. they arrive at 1:30am and have been instructed to call someone when they arrive. Since they arrive so late, if you would prefer to meet with me earlier in the day (I live just up Nathan Road) perhaps I could get the info/key then and let them in later on. this might not be possible since you may need to meet with them directly, but let me know if this would be more convenient.",,,,,,,,,1
"hi, can you block the dates for us? I need to discuss with the rest and confirm the booking by this Friday.",,,,,,,,,1
This is Antony here working IT professional . Need Your master room for rental between 28Jan to 9th Feb.Just got married recently few months back and my wife is coming as a tourist to see around Singapore .Hence need this room for short term rental. Please let me know when I could take a look and book it asap. 9ab4cd5ef1gh0ij4kl8mno6 my no,1,,,,1,,,,
"Hello! I am interested in renting your apartment February 8th to 18th. Please let me know if it's still available. Many thanks, Chris",1,,,,,,,,
Hi John i just wanted to double check if the highlighted dates are still available. So i can proceed with making a bookingRegardsWimbiso,1,,,,,,,,
Hello. I'm Tiyani. A diplomat in Australia travelling Singapore for a family holiday. Is your apartment available during these dates.,1,,,,,,,,
"Hi, I'm looking to rent our place for a 4 nights in November. Please can you confirm the availability, price and address of the property. Many thanks, Abi",1,1,,,,1,,,
"Dear Sutisa,I'm interested in your apartment but am concerned about the noise from the airport train. Is it noisy and often?",,,,,,,,,1
"hellogud evening to your goodself.im christina from kuala lumpur, looking for home stay for our family gathering (unity), im looking and would like to stay for 2 day 1 night in ipoh. we are 10 in one family. please respond to my mail,if any availability.thanks",1,,,,,,,,
"Hi there, are these dates available?",1,,,,,,,,
Hi would I be able to inspect at some stage ? How much a night in mid Jan? Rosemary,,1,,,1,,,,
"Hi, My name is Milan Ilic i'm interested in one of your properties for a one night stay. I have a couple questions, can you please call me at +-- ---- ----.Thank you.",,,,,,,,1,
"Hi! This is Maria Victoria David. I would like to inquire if the apartment is available on January 12-14, 2016. We are 4 ladies travelling together. How much will be the cost of the rent for the duration of the stay? Hope to hear from you. Thanks.",1,1,,,,,,,
GREETINGS! My mother Mrs. Pranati Sen is a cancer patient who came along with me and my father from Bangladesh. She will uundergo surgery at hinduja hospital. We are looking for an service apartment for long term stay starting from next month. We are interested about this apt. If you agree please let us know the details. Thanks,1,,,,1,,,,
Hi can we reserve this from dec24-25? We will be having our friends to come along for dinner too. Thanks.,1,,,,1,,,,
"Salam Rasheed, I am looking for accommodation for 7 people for three nights. I have seen 5 listing under your name. Could you recommend the best one and the price. ksThanksNooru-Mohamed",,,,,,,,,1
I just book your room. May I have full address. I am supposed to check in this afternoon. May I learn how I may check in too. Thanks. Harry,,,,,,1,,,
-------.--- family would like to stay at your place for Dec30 to Jan1.We prefer adjoining rooms or a villa with 4bedrooms.How much will be the cost for our 2nights stay?tnx and hope to hear from you soon.from Jayne Dela Cruz. +-- ---- ---------@-----.---,,1,,1,,,,,
HI is your place available on December 17-20? thanks,1,,,,,,,,
I want a single bed room fully furnished apartment for the above period,1,,,,,,,,
"Hi, is your apartment available from 29 Dec to 2 Jan, 3 person? Will portable wireless be provided?",1,,,1,,,,,
"Ms Joy I am looking at your apartment can you confirm that all bedding and towels are provided. Also as I am here for nearly three weeks do you have a cleaner that will come in. although most of the time I will be on my own I do have two business that will be flying in for 4 days , therefore will your apartment be able to accommodate. Finally would give details of shops etc in walking distance from your apartment..regards Simone",,,1,1,1,,,,
Hi LisaCould you please confirm if your apartment is available for the above dates (18 nights) and confirm the full cost of this stay.My wife and I are looking to visit our daughter who is currently working in Sydney.Thank youLes and Dave,1,1,,,,,,,
"Hi Yuh-San, we are a family of 2 Adults and 3 children (14,8,6). Is this ok for you ? We don't mind using just 4 beds and i hope you are ok.If we are coming from kyoto station, how can we reach your place ? Thank you",,,1,1,,,,,
"Hi Kamran,Interested in the master bedroom. Looking for 3, potentially 6 months as family is in Abu Dhabi and I need to work in Dubai.If this is ok, may I please view the room this Thursday (19 November) evening?Best regards,Ajai",,,,,1,,,,
Is the property still available? Can you tell me a little bit about the place? Do we have access to all hotel amenities during our stay?,1,,,1,,,,,
"Hello, We would like to book your villa from february 16 to 27. Please could you confirm if the villa is available ? Thank youKind regards, Petra",1,,,,,,,,
"1) Please can you confirm the availability between 25th Dec 2015 and 31st Dec 20152) Also confirm the rate for 6 night to be INR 46,899.3) Please also confirm that the price above is for the entire villa which includes 3 bedrooms.Thanks.",1,1,,1,,,,,
Hi! I'd like to know if the cleaning fee is something I have to include with the payment in the room per stay? I'm planning to stay in HK with my friend for 4 nights. Thanks!,,1,,,,,,,
Just after a price for these nights thanks,,1,,,,,,,
"Hello Di, I am still try to finalize my vacation and actively looking for a place to stay. Is this unit available from Wednesday 10/28 to 11/18/2015?And if so, what would be the lowest total price for the whole stay. Please let me know, thank you very much.",1,1,,,,,,,
Family of 5 coming from Brisbane for New year in Sydney. 2 Adults and 3 children,,,,,,,,,1
Looking for 2 bedrooms for 4 of us at Anjuna. We usually backpack and take rooms once we are there but just checking if rooms are available with attached bathroom at around +-- ---- ---- each. My Mobile is +-- ---- ---- Stay for 12 nights,1,,,1,,,,,
We required service Bunglow on above mentioned dates. Kindly contact to +-- ---- ---- for further negotiation.,1,,,,,,1,,
hi buddyits my pleasure to contact you !is there any room available for cheap cost and how much is it..and is it possible for me to pay on time when I reach Dubai ?? thanks in advance,1,1,,,,,1,,
My husband and I are in our sixties and live in the USA. We have two grown children who are married and live in Asia. They each have one daughter (one is age 4 and one is an infant age 7months). We want to spend the Christmas holiday with them and their families in a comfortable villa with plenty of space. Your house looks perfect.,1,,,,,,,,
"Hello,How about monthly rate? I may stay for 2 months.And how many bedrooms in total. Thanks!Angela",,1,,1,,,,,
Good morning. You have a pretty neat place. We are interested. We are coming from Cebu. Thanks. Looking forward to staying in your place! Is the unit available for rental?,1,,,,,,,,
I would like to book the room for these dates.I chose 2/28 because we arrive a little after 12am on Sunday... is that OK?Is there a safe in the room? How far are you located from the airport (BKK)/?Look forward to staying at your location :),,,1,,,,,,
Hi I'm interested in this rental for a week in January. Can I please get a phone number so I can have my fiancé can contact you to look at the place and get more details. Thanks,,,,,,,,,
"good afternoon i would like to know little more about your home as we are looking somewhere to stay in august for 4 day, how far is mtr from your house thank you kind regards steven weckert",,,1,,,,,,
I am interested in your apartment for the days stated - we are a family of 3 adults.Couple of questions please;- what would be your best price?- which floor is the apartment on?- Is there a balcony ? if so do you have a photo of it?ThanksChris,1,,,1,1,,1,,
may i know tat apartment name? thx,,,,,,,,,1
"Dear Colleague,Greetings from Koh Samui!We looking for a Luxury villa for our clients.We will offer to our clients Krabi Beach House.Could you please tell me about villa.1) Which beach exactly this villa is located ?How far from the beach ?2) What about neighbourhood around villa?3) Is it possible to close a third and fourth bedrooms and and give us a lower price?Regards,Natalia",,1,1,,,,,,
Hi there can I pay u went I'm in hong kong,,1,,,,,,,
I am traveling with my husband and sister from london and wish to stay for the above dates,1,,,,,,,,
"Hey Harry, how are you? Im interested with your condo. !8-20 September. But we are only 4 girls, therefore we need 2 bedrooms only. Is it possible to use only 2 from 4 you have and reduce the price into half?That would be great!Look forward to hearing from you soon.Regards,Riezka",1,,,,,,1,,
Hi my name is Derek from Ireland.I am travelling to PATTAYA with my family for 6 nights and am wondering if your villa is available for rent,1,,,,,,,,
"I WANT TO RENT YOU CONDO FROM JANUARY 7 TO JANUARY 14, DO YOU HAVE A GOOD DEAL FOR 1 WEEK RENT?",1,,,,,,1,,
"Hello, my name is Fredrik. Me and my friends are going to Tokyo on the 28th of october and we are going to stay in Tokyo between the 28th of october and the 25th of november. We are going to be four people and we are wondering if your apartment is available during this time and how much it will cost. We are also wondering if we can check out at 8:00 am on the 25th of november because our fligts go quite early. Best regards, Fredrik.",1,1,,,1,,,,
"hi... I am kemal, is there any empty room (1 room) ?i would like to stay.thank you",1,,,,,,,,
"Hi,Does the villa come with staff and a driver? How far is it from Walking Street?",,,1,,,,,,
Lady aged 35...I'm in between houses in dubai...im a flight attendant with Emirates Airline,,,,,,,,,1
"Hi Ken.I am keen on the apartment, I just have 2 questions, is there a fee for a car park?And the trip is to take my Mother and Father inlaw around to see parts of Australia, they are both smokers, and I am not sure how they would feel about having to wonder down to the street for a smoke, does the apartment have a balcony, or a smoking area within the complex.For all I know they may be ok with going outside, I just dont know.Cheers, David",,,,1,1,,,,
"Hello - I am moving back to Israel with my wife and 18 month old son. We are looking for a 2 bedroom apartment to sublet for 6 months starting around December 1, and came across your listing. Would you be open to a 6 month sublet?Can you also tell me what floor the unit is on, and if there is an elevetor.Look forward to hearing from you!Brian",1,,,1,1,,,,
"Hi,Is its possible to book for an overnight stay? it will be a short get together with friends only (Dec 4 - 05)",1,,,,,,,,
Hello My name is Stephany and I new in this country I'm planing to stay 4 nights with some friends in Sydney but I don't understand if the price is only for night for each person or for everybody each night ???,,1,,,,,,,
"Hi there, I am Joe. I am interested to know more about the homestay. Is it available on the coming 20 to 30 Oct?What is the best price could I get?",1,1,,,,,,,
hello is this dates available,1,,,,,,,,
I am interested in your room. Is it available during 1-9 april?,1,,,,,,,,
is it enough for 4 people? this is the one next to coffee prince right?,,,1,,,,,,
"Hi, please tell us more about your location. Thank you, Bertha",,,1,,,,,,
"Hello, I live in Misawa, Japan and my family members are coming to visit. We are traveling to Kyoto 30Dec-03Jan. There will be a group of five of us Ages: Me (M) 36; Dad-Tom (M) 70; Mom-Beth (F) 65; sister-Cecily (F) 34; her fiancé Bryan (M) 34. We are looking for a place in Kyoto to be our home base as we travel around the area. Is this something you could accommodate? Thank you. --Bill Griesser",1,,,,,,,,
"Hi I am interested in your apartment.However I have some questions: 1) My father is on wheelchair, it is accessible?2) My budget is arnd sgd 3000, is it possible to have this price for your apartment?Thanks!",,,,1,,,1,,
me my husband and my 13 yr old son are visiting thilanad between 27 jan to 30 jan,1,,,,,,,,
"Hello - 5 friends are looking for a villa that will have a room and bathroom each., where friends are allowed to be brought back to the villa in the evenings. Please can you send me some suggestions.",,,,1,1,,,,
"hi, i will book your apart",,,,,,,,,1
I would like to stay in sept 1 to sept 5 is it available?,1,,,,,,,,
"Hi,I hope you are doing well. My name is Ishara and I am trying to figure out accommodation for a couple of friends of mine when they visit Sri Lanka for my wedding March 2017. We have about 10 guests travelling with us and the dates are not certain but it will be for about a week and a half to two weeks that we are looking for a place for. I know this is probably not a normal request but I was wondering if I could come see the place sometime in December 2015 before we make a decision on wheth",,,,,1,,,,
I am from Syd Australia I am going to Kolkata to attend a wedding with my family. We are 8 members/ I was wanting to know if this is available during that time and also how clean it is and is it fully furnished as shown in the pictures,1,,,1,,,,,
"Hi Sho & O, we're a family of four (boys 7 and 9) from Canada and looking for a place for two nights in Tokyo. We're flying into Haneda March 30 then out of Narita on April 1. A friend suggested we should stay in Asakusa. Hoping your place is available!ThanksSheila",1,,,,,,,,
"We are looking for a place for our family to stay while my brother has a craniotomy and other brain tumor related procedures at CHI St Lukes. I believe your place is close to the hospital. It will be myself , his wife and my parents coming and going from Georgia to assist in his recovery. We are not certain on the date that he will be able to return home but understand we can't have an open ended reservation. We would like to negotiate a monthly deal. Holly +-- ---- ----",,1,1,,,,,,
Hello. is the room available fr 3/4/16 to 7/4/16,1,,,,,,,,
HelloI am interested in renting this property and would like to confirm what the costs would be for the dates arriving 11 Feb 16 departing 14 Feb 16. Could you also please confirm cleaning and security deposit amounts. Also are there any other charges associated with the rental?It will be just be 2 people (not a couple).Kind regardsSandra,,1,1,,,,,,
"hi dear...read all the reviews of all your guests.. they said Hungarian couple live there too.. are your rent the house entirely or a room occupied by Hungarian couple??, because I prefer entire house for my visit to TokyoJakarta",,,,1,,,,,
"Hello! I was wondering if you had availability Dec 28 to Jan 3. Also, do you have photos of the bathroom available or a description? Thanks!Jacinda",1,,,,1,,,,
"we are considering your property for a vacation in the above dates. We are an australian family currently living in Sumatra. does this villa have a bath? is it possible for you to arrange a pool fence?thank you in advance,Laura Scarr",,,,1,,,,,
How much will this cost? Thanks,,1,,,,,,,
"Hello there, i have some enquiries regarding the villa, I'm planning to stay from 13th march to 16th march and also there will be 7 adult and 4 children can i make a request for:1. 1 baby cot for of my niece2. The price for airport pick up3. the price of breakfast for the rest of our stay there because i understand that you will only provide the first breakfast.I hope to hear from you soon because i need to make booking fast.regards,Budi",,1,,1,,,,,
Hello!I'm visiting San Andres between March 22 and 30 with my family (5 people).Is this apartment still free?Thanks!!,1,,,,,,,,
"Hi, Im looking to rent a studio or apartment for a month or so on the panglao island or close. Im a canadian and I will be in Philippines for 2 months start January 2016. How would like to have some informations about prices and available studio with more pictures please.Thank You very much",1,1,1,,,,,,
Hi po. I'm just wondering po if there's a way we can book your house by paying cash and directly to you po. Thanks,,,,,,,,,
Is it early check in available around 12pm.,,,,,1,,,,
Family trip here is my e mail -----@-----.---,,,,,,,,,1
"Hello Sarah,We are a group of 6 friends (Friends from the Kindagarten days) planning a trip to Goa from Hyderababad.Can we accomodate ourselves in 2 units, please.Do let us know and we want to book accordinglyRegards,Kishore",1,,,,,,,,
"Hello, I'm Jenny from Hong Kong. My friend and I are planning to come to Tokyo from 31st Dec to 3rd Jan for Christmas countdown. We would like to stay at your apartment during our holiday because the location of your address is very convenient and the accommodation looks very comfortable. We also saw the comments below your website and we think it will be our pleasure to stay at your house. We would like to ask if you still have a room for 2 ppl during this period? please do not hesitate to contact us if you need any further information. Thank you.Jenny ^_^",1,,,,,,,,
"Hi there, could you let me know if you are available for 26-30th November?I am 33, a managing director of a company and this is part business, part relaxation for my team, we will be based in Miami taking a few day trips in and out. We are keen to book soon.",1,,,,,,,,
Sorry....This is the first time I did. After the transaction then what I should do. At the location ... who had I call?Thanks,,,,,,,,,1
"Hello, we are interested in your rental for the weekend because it's birthday celebration. Ages range from 30-50, and we would like to know the price also and how far are you from Sun Life Stadium.Thank you",,1,1,,1,,,,
Do you have ------- or line account.How to reserve.,,,,,,,,,
"my boss is inquiring about your apartment. can i ask for the exact address of your apartment and contact number? how much will it cost if they stayed there on sept 16-21, 2015?",,1,,,,1,,1,
"In regards to check out, may we have a late check out at 11:30 a.m. instead o 10 a.m.?",,,,,1,,,,
Please contact us regarding our stay from 11/1 to 17/01,,,,,,,,1,
"Hello Nonko san,Greeting!Still waiting for your reply. Can you please help?Please quote us your best price as we love your balcony! Thanks!",,1,,,,,,,
2 families- 4 adults and 4 kids (under 8) in totalLooking for accommodation with chef and babysitters available.,,,,,,,,,1
"Hi Yu, I'm Novi from Jakarta, Indonesia, I want asking you about availability to book your room on Oct 28, 2015 until Oct 31, 2015, there is available for us, I will visit to Singapore with my family consist of me, my hubby, and 2 child. There is additional charge for my child or the charge only for 2 guest only ? And awaiting your good confirm. Thx.Best Rgds,Novi",1,1,,,,,,,
"Good Morning, We have booked flights to bali for next feb the 19th - 25th.We are looking for a 4bedroom villa as we have 4 couples in our group going. I was just wondering if you could please send me a price for our 6nights stay. Also is this a private pool villa?Do all bedrooms have a double or queen bed ? How much would we need to pay upfront and when would we need to pay the rest by?Also is there no charge for cancellation if we needed to (which i doubt we will)  Kind Regards,Michaela",,1,,1,1,,,,
hi looking for one day stay with my gf . do not have id proof . looking for room for local unmarried couple . if it is ok let me konw,,,,,,,,,1
"Hi David!We are looking for a semi-short-term stay around Shipai area. Do you offer any discounts for 30 day stay? I look forward to hearing from you. Thank you! Regards,Kristy",,1,1,,,,,,
"Hello, David!We are going to visit Phuket next December and we like this appartment. My family: me my fife her parents and 3 kids (9, 11 y.o. and infant). Could you check available and tell me a few words about this place.Best regards,Sergey Koryagin",1,,1,,,,,,
hi i am looking for an affordable accommodation my tentative travel is between last week of july to 2nd week of august. kindly let me know the available dates,1,,,,,,,,
HiCan I use ur flat for 2 adult and 2 children (5 and 4 years old)? Is there any supermarket near your flat?Thank you,,,1,,,,,,
"Hi ,  Im Vishwanth Kota , Im looking for a homestay in goa for the dates 30th dec to 3 rd jan < 4 nights stay , We are 3 couples travelling , total of 6 people , we would like 3 bedroom villa with swimming pool for these dates , can u check with the availibility and revert back asap for us to book with you . my contact mob - +-- ---- ----email - -----@-----.---thank you vishwanth kota",1,,,1,,,,1,
"we, a family of 5 people need a guest house for 3 days.I would be interested in knowing the location of the apartment,charges and facilities provided",,1,,1,,1,,,
Hey Sally ..I am ready to book however would like to book Nov13-16 for now and if it works out we may like to book more days..i am online to book with your previous approval if ok. Thanks for your consideration. : ))JT,1,,,,,,,,
"Professional Businessman from Qld, Australia working full time in Singapore. Will be in the office 6 days a week.",,,,,,,,,1
"Hi, Could you send me more pictures of the villa with the private pool?",,,,,,,,,
"Hi, is it possible to see the room? How much would be the overall cost for 6 nights (22Sept in - 28Sept out)",,1,,,1,,,,
Need two rooms only for 4 days,1,,,,,,,,
"Hello, I would like to rent the apartment for the period 13/10 to 18/10. Is it available ?",1,,,,,,,,
"Hello, I am coming to an event at the Asia Pattaya Hotel in February and looking for somewhere local to stay.I need to check in around 6pm on Monday 8th February and check out early on Wednesday 17th February.Are you able to offer a discount as it will only be for one person for this time?Many thanks in advance.ClaireClaire EdwardsPS: Do you have wifi in the property?",,1,,1,,,1,,
"Hi, My name Gibzy, from Thailand. and I have plan with my friends to go to Singapore and I interest of your accommodation for my trip. It's very nice and seem comfortable. And can you recommend the another room for 4-5 persons. Can you give me for more information such as which MRT station or any else, or any inf. that I should know and preparation for my trip (my first time for this trip) Thanks. :)",,,,,,,,,1
"We are looking to rent for the above dates, and are very interested in these apartments we would be grateful if you could send us any details and prices...King Regards Christina Thompson",,1,,,,,,,
We want to know how much will be the total rate because we plan to rent it for 3 months starting the 17th of Oct till end of december or first week of january.Hope to hear from you.Thank you!Maricel Ramos,,1,,,,,,,
Hi I would like to book your apartment with my family . I am from the UK but I have not complete with my flight details and travel plan during my stay in KL we would like to visit Penang for 3 days but I do not know which 3 days at the moment wonder if I can book the whole 12 nights with you and may be I can have 2 nights discount from you save me check in and out again . Look forward to hear from you,,,,,,,1,,
Hello i'm Keith.Bringing 7 people for cooperate gathering.So yr place is total how many bed room and bath room?Wanna rent the whole place for private groupDo u have living room and kitchen??Pls let me know,,,,1,,,,,
"Hello,I would like to ask if the flate is available for a week? And if we can see it by today or tomorrow morning? Thank you.",1,,,,1,,,,
"Hi Alex,I'm travelling with my husband and 2 adult children and another family with 2 adult childen.We need a large property with a pool with many bedrooms as your gorgeous house is.Are you able to tell me any landmarks where your home is located and how central the property is?I am making the enquiry for all other parties.Thank youSilvia",,,1,,,,,,
"I am a 25 year old single female. Starting work at Royal North Shore Hospital, as a registered nurse and looking for convenient temporary accommodation.",,,,,,,,,1
