Message,Availability,Payment,Attraction (Experiences),Facility,House Rules,Location,Discount,Contact Host,Others
"Hi, I need the entire Villa from 30nov to 4th Dec 2015, 4nights. We are in total 7 couple in the age bracket 35-42 from India.Can we get the availability.Regards.Navin-----@-----.---",1,,,,,,,,
"Hi,This is Nino Muli. We are planning to have a family vacation on February. We find your place very nice however we are quite a big family. I would like to ask if you could possibly allow 10-12 persons given that we are OK to fit ourselves in, we will take very good care of your place, and we can bring extra mattresses or pillows. Also, is there an elevator or ramp accessible for wheelchair? Should there be any charge per additional person, please inform me.Thank you!", ,1,,1,,,,,
"hiI would like to ask about this apartmentIs it possible to make more discount on the priceOr that you have found an apartment in the same area, one bedroomAt a lower priceThank you", , ,,,,,1,,
"Saturday Wedding of a friend at The Chapel on the Hill. How do I go from this hotel to the venue of the wedding? Is the bus from Taft, Pasay to Tagaytay going to pass through your hotel?", , ,1,,,,,,
"I would like to see some pictures of the garden. My husband and myself are planning a private wedding ceremony with approximately 40 guests, and we'd like to see if the garden would be able to accommodate that many people. Thanks.", , , ,,1,,,,
"Hi, may I ask if possible for long term rent ang studio unit s exchange? At may almost 2yr old baby girl kmi. Looking for a new place,we wont renew our contract s current unit nmin. Thanks and looking forward s reply nyo. You may reach my wife po at +-- ---- ----. ThanksRegards", , , ,,,,,1,
"I would like to book now, could please send me your contact please.. Dinakar : +-- ---- ---------@-----.---",1,,,,,,,1,
"Hello, we are travelling from Canada and would like to stay in your lovely apartment. We would have liked to stay for the month but see that there are 4 days that are not available. Wondering if this is a firm reservation for those 4 days? Please let us know the total amount of cost till March 13th. Thank you Brian and Audrey",1,1,,,,,, ,
Let me know the availability and the good beaches arround,1,,1,,,,,,
"Hi. How are you? My family and I will be having a vacation in Cebu city this coming Jan. 1 to 6. We are looking for a place to stay and enjoy and luckily I found your place. I would like to ask if you can accommodate us. We are a group of 6. No kids, all adults. How much will it cost us for 5 days stay? If possible in Peso. I will wait for your response. Thank you",1,1,,,,,,,
"Hi, im nurul inayah from Indonesia..Im planning to go to seoul in february next year with my other 3 friends for holiday..im looking for the room to stay for 4 nights and i found your page here, and i think this room has everything we need like 2 queen beds, kitchen and restroom inside, and near to subway and many attractive places.. so i'd like to know if this room still available for us or not.Thanks",1,,,,,,,,
"Does this unit have a sofa sleeper in the living room?Thank you, Bill Sweeney",,,,1,,,,,
"Hi there! I am inquiring about a room available in your establishment for 12/27/15-1/2/15. Is there availability? Where about in the beach road are you located? Do the rooms have air conditioning? Private bathrooms/showers? Thanks so much!Cheers,Leighann",1,,1,1,,,,,
"HiIs your room for a month rent still available? Or maybe for long term, 1BR 1500/mos right? +-- ---- ---- is my number",1,1,,,,,,,
"Hi Mike, this is Anurag and I am from India. I am planning to visit Singapore between 15th March and 25th March along with my wife and 2 kids ( 7 year and 2 year old ) let me know the availability and the total charges for 10 days including any taxes if any.",1,1,,,,,,,
HiWanted to book this including a chef for all meals while we stay there and also a nanny to help with the kids. And need three baby beds.,1,,,1,,,,,
"Hello Vix,Trust things are fine at your end.I am travelling on 23/12/+-- ---- ----/12/2015 with family & friends for a leisure in Pattaya. I am looking for 3 bedroom & a private pool villa.Kindly let me know if the dates are free in La Ville Pool Villa.Regards,Prakrit.+-- ---- ----.",1,,,1,,,,,
Hello. I am joy. The masters room can accomodate 6 pax right? Can view the room?,,,,,1,,,1,
"Hi, Can I rent the whole house? And how much for the whole house? Thanks i'm looking forward for your reply -----@-----.---",1,1,,,,,,,
How long time to going kuta beach? Can i get ur number?,,,1,,,,,1,
"Hi, I am Janice, contact no +-- ---- ----, we have about 12 adults and 4 children, want to check in on 09 January 2016 and check out on 12 January 2016, can I check the availability?",1,,,,,,,1,
"Hi,I have interested on your house but my flight reach Haneda Aiport about 10.30p.m. I am not sure is that have any transport to your house on that time. Kindly advise.", ,,1,,,,,,
"kindly confirm availability for 4 persons, from the 20 to 25 October more 1 adult from the 22 to 23 Octoberitalian family from Milan.-----@-----.---",1,,,,,,,,
"Brian, my name is Douglas Winget. My family is my wife Bel, 2 boys 8 years old and myself. We live in the Philippines permanently, yet we will be traveling on our USA American) passports.April and May are the end of school year break for us. My sons have been taking Mandarin Chinese language lessons.Our purposes in visiting Taiwan are to enjoy the many Chinese cultures represented in Taiwan. We want to become familiar with Taipei and also see mountains, tea plantations, temples and other cultural sights.Besides being our host in Taipei, we hope you will advise us on on how to make the whole vacation very meaningful for our family. We hope to hear from you soon. Thank you, Douglas.",1,,,,,,,,
Hi i would like to ask you the location of the apartment which floor and is it near the marina walk and can i pay when i arrive there and how much deposit u want, ,1,,1,,1,,,
I'm interested to know more about this adv. Can u contact me at +-- ---- ---- Michael., ,,,,,,,1,
"Hello, My husband and I are going to be visiting Australia from February +-- ---- ----. Your place looks beautiful and we are very interested. Is it possible that you could tell me the total price for the 9 days we are there. I understand that there is a cleaning fee could you also confirm how much that is. We are from Canada and have been to Sydney previously and visited Bondi Beach but this visit we are hoping to stay right there. Thanks so much for your quick response. Deanne", ,1,,,,,,,
"Hello , I, d like to know prices for the days selected . We are 4 women aged 60 .please let me know the payment policy .I wait for your replay as soon as you can .Regards Olga", ,1,,,,,,,
"Hello,I am looking for a place to stay minimum of 3 nights with my boyfriend. I was wondering if you have availability and perhaps a picture of the inside?Kind regards, Marieke",1,,,,,,,,
"Hi Jay, Is there any way to contact you by phone #?We are in the US, and is planning our trip to Taiwan.We have a group of people like to book your place.Feb. 28 to March 1, for 2 nights.We need 3 rooms. Two room with 2 beds (for 4 singles), and one room w one Q size bed.March 5 to March 7, for 2 nights.We need 3 rooms. Two room with 2 beds (for 4 singles), and one room w one Q size bed.March 13 to March 16, for 3 nights.One room with 2 beds (for 2 singles)March 13 to March 22, for 9 days.Thank you!Frances",1,,,,,,,,
"Hi Dianne,Hope you're having a great day. I just wanted to inquire if my preferred date is still available. Also, about 4 people will stay the night while some of friends are only going to be here the whole day for our simple gathering together with their kids. About 6-8 kids aged 0-8 are expected to come. Total pax roughly around 20pax (including kids).Please advise if your place can accomodate us. We just wanted a decent and safe place to stay considering we have 2 infants joining.Thanks and hope to hear from you soon :)Best regards,Che",1,,,,,,,,
"Hi, this is Ziv lee form Hong Kong.I will go together with 2 friends, and this is our first time to Japan also.We would like to plan a travel visit to Osaka from 21/Nov to 22/Nov.We just checked the room available in this online website, and it looks beautiful and good to us.Would you please help to check and advise the room available in this period?We would like to inquiry this room reservation method.1) We need to share the apartment to other people?2) We need to share the bathroom to other people?3) Any pet in your apartment?Looking forward to hear your good news.Thank you very much!",1,,,,1,,,,
Hello!We are turist from Poland.We would like to stay 2 nights in Osaka (09-11. October). We would like to book private room for two pepole. How much it will be costs? Thank You for answer.,1,1,,,,,,,
Please specify the cost during this period!,,1,,,,,,,
May I know the walking distance from XiMenDing to appartment?Is the additional person charges included bed?,,1,,,,,,,
"Hi This is raja shekar , i want ti visit your hotel for 1 2 day before that i want to talk to you so please get in contant on my no +-- ---- ----",,,,,1,,,1,
I'm the organiser for the group.We need villas for 24-28 people with communal areas for meetings.,1,,,,,,,,
"My husband and I re traveling there and we are interested in stay there, but would like to know if the dates are available? how much is the total and what do we need to do to book it. thank you,Michele.",1,1,,,,,,,
"Dear Divine, We are looking for a place for Sat Oct 10 for 1 night. Is your place available? I am traveling with my husband and my 33 year old son who has a 2 year old. My husband and I are math professor from connecticut. My son teaches english in Massachusetts. We are in town for the wedding of a friend. Your place looks awesome, and I love the location. Feel free to call on the phone if you would rather that than email. +-- ---- ----Thanks, June Decker -----@-----.---",1,,,,,,,,
"Dear whom all concern My Name is suriya Saktanawat from Thailand . I working at Fuji Tusco Switch board in Position Production Manager. (We are branch of Fuji Electric in Thailand) On Mar 26'16 to Apr 4'16 my family plan to travel in tokyo. And now I look for hotel. In this trip we are total 9 peoples . 6 Adult 2 Junior school (Boys 14 Year) and 1 girl (7 years) . Are you have room for our?. Your Apartment is beautiful , big and clean. and my my family very lite it. My Fight is DL284 SAT 26 Mar BKK (07.05AM) > NRT (3.05PM)and return DL283 Mon 4 Apr NRT (4.00PM) > BKK (9.05PM)Please offer your proposal to me at email -----@-----.--- , -----@-----.--- , -----@-----.---for -----@-----.--- is business email . I can check only working day. , Please cc to -----@-----.--- for easy to continue communication.My ------- suriya saktanawatId Line : tu0166Mobile : +-- ---- ----Your understanding and cooperation would be appreciated. I hope your to confirm booking as soon as possible.Thank you & Best Regards ,Mr.Suriya SaktanawatProduction Division ManagerFuji Tusco Switchboard Co. Ltd.Tel :+-- ---- ---- , +-- ---- ---- Ext.3118Fax :+-- ---- ----Mobile : +-- ---- ----Website : -------.---Email : -----@-----.--- , -----@-----.---",1,1,,,,,,,
"Subject: Month Long Villa Rental 1 or 2 bedroom Beginning 3 September 2015Hello,I am interested in a month long rental beginning 3 September 2015 for at least one month for one person. 1 or 2 bedroom is fine. Could you please kindly tell me your monthly rate?Thanks,AJ-----@-----.---",1,1,,,,,,,
"This is a family outing, mother, children and 2 grandchildren. I would like to request the exact address, floorplan including bed sizes to better plan sleeping arrangements (and how the fourth bathroom will be shared.) Thanks.", ,,,1,,,,,
"Hi, we are 4 friends and coming to Dubai from 1 /12 to 7/12 is there enough beds for four persons.",,,,1,,,,,
May i know your apartment to somerset mrt is it walking distance?,,,1,,,,,,
"Hi! My parents and and sister is coming to visit me here for from dec 18-jan5, 2016. I only stay nearby Aljunied too and would like to know whether they could rent the room during this period? if not, dec 24-27 would also be fine. I hope you can give me a good price. Thank you.",1,1,,,,,,,
Checking availability for 9/22-9/25 as well as deposit and cleaning fee rates. If available we would like to reverse as soon as possible. Thanks!,1,1,,,,,,,
"Hi, I am visiting with my family (total of 6) from New Zealand and would like to stay at Kyoto for 3 days, just want to see if your house is available at that time and also what kind of bedding arrangement do you have? and do you have parking?thanks",1,,,,,,,,
HelloWe are a group of six adult French.We would like to know if your house to rent is available from 16 till 23 August.Thank you .RegardsGwendoline,1,,,,,,,,
Hi JanetAre you able to post photo of outside of the building?Thanks. Henry,,,,,1,,,,
how can i contact you for faster transaction?,,,,,,,,1,
"Hi There,We are young family relocating from London to Sydney, and looking somewhere to stay 3-5 weeks till we find accommodation for long term. Our jobs located in North Sydney area and your little studio would suit as most.Could you please advise on the flats availability from 21 of February? Could you please contact me on -----@-----.---  Vladas Genys",1,,,,,,,,
I interested to rent your appt on the date above can you get back to me please and where is it located.VRBO listing +-- ---- ----ha,1,,,,,,,,
"Hy , We are looking for a rent during August and me and my friends find you apartment we wanted to know if you can do a price for us Thank you", ,1,,,,,,,
Greetings!How much would you charge for a 10day stay? Thanks very much and looking forward to hearing from you.,,1,,,,,,,
"What would the rate be for the requested dates? Thank you, Judy",,1,,,,,,,
"Hello good pm, is this near to taal vista hotel po? Will be attending a wedding, photoshoot will be in taal vista for us na member ng entourage kasi, And how much po for 15pax?", ,1,,,,,,,
"Dear Vaishnavi,Greetings from Dream Works Travel & Tours!!!I'm looking to hire service apartment in the month of January 2016 from the 20-Jan-16 to 25-Jan-16 for my client who are planning to attend the conference at Codissia Trade Fair Complex.Hence, I am humbly requesting you to email me your Tariff along with the commission structure i.e. TAC (Travel Agent Commission) Looking forward to hearing from you.Kind Regards,Hemant Bhupen DesaiDream Works Travel & Tours",1,,,,,,,,
HelloYour apartment looks beautiful. We will be visiting our daughter who will be studying at Tel Aviv University. We are looking for an apartment for approximately 10 days Are you near the University? On the beach? Can you tell us anything else about your apartment? Looking forward to hearing from youLaurie Chefitz,1,,1,,,,,,
"Hi, need to know location of said property as we need to commute to work when in SG. Also, if we book for the month, would the rate be better?Cheers", ,1,,,,,,,
My daughter is currently completing her PHD in Shanghai and I would like to rent this apartment for her for 3 months October-December. Would the apartment be available for an extended stay? What would be the monthly rate and what additional charges would be involved? Thank you for your assistance.,1,1,,,,,,,
"Hello,Is your apartment available during these dates?Is the price the same?Sherri",,1,,,,,,,
"hi Lily, i'm Debora, me and my mom are indonesian chinese are goin to travel to Singapore on 23rd to 25th august, as my mom is 60yrs old wondering if the building any staircase? and only min 3 nights stay ya? as we need only for 2 nights, thanks",1,,,,,,,,
Hi James may I know if the house is wheelchair friendly as my mom is wheelchair bound? Thanks to let me know so I can decide.Kind regards, ,,,1,,,,,
What do you have for parking at your location? We will be in Chicago tomorrow night. would your room be available? If so me and my husband would love to stay. We are from Utah and it's our anniversary!,1,,,,,,,,
"Hello,We are planning to visit miami from 4/20 to 4/24 and are 3 young couple with 4 children. Let me know what is the best total amount you can do for this property to rent for 4 nights.Thanks,Amit",1,1,,,,,,,
Do u have other apartment in ximending. Sorry I just found out that this is not ximending. Sorry for tgat,1,,,,,,,,
"Good day! Going to visit Montenegro with my family - husband and 3 children. Tell me, how far is it from the sea is your apartment? Convenient if I will with children 4,6, and 8 years?", ,,1,,,,,,
We are very interested in booking your apartment. We are a group of six adults in our mid 50's. There may be another couple joining us but we will not know until a later date. Can we contact you at that time to inform you and pay the extra? Also does the apartment building have a name for reference purposes? A street address would also be helpful. Our flights arrive at 8:00 pm so it would be a late check-in.,1,1,,,,,,,
"hi! my name is Nathania, and I would like to book your apartment. My family is coming to Taiwan for holiday from 8th February to 13th February. Can I know what floor is the apartment and is there any lift? I am a student in Taiwan, is there any chance for me to look at your apartment first before booking it? Sorry for the trouble, Thank you in advance.", ,,,,,,,,
"Hello,a family of 7 would like to stay in your apartment for 4 nights in August , from Tuesday 30 August to Saturday, September 3 .You advertise sleeps 10 in your description , I count 5 on the pictures. Can you describe the capacity of each room and please confirm that the air conditioner is central?Thank youAS HoffmannTravel agent, Montréal, Canada.", ,,,1,,,,,
I am struggling to find a home for myself mother and two sons until Sept 1st can u please tell me how much it would cost me to stay in your sweet little home for two weeks maybe longer . will not know until Sept how long I will need the property. Please contact me stAt +-- ---- ----Ask for Tammy, ,1,,,,,,,
"hi, please send details abot this house thanks",,,,,,,,,1
"Hi Nuno, I'm traveling with 4 other friends and am looking for a 5-bedroom villa set-up in Pattaya, the dates are Saturday 25th July to Monday the 27th. We are all professional 40-somethings (finance, tech, design). I saw this listing and it looks great but I noticed that your calendar hasn't been updated in awhile. Is it available? Do you have other properties that are similar in location/price/niceness?",1,,,,,,,,
"Hi good day, Can a ask if the kids age 3 and 5years old is free for stay at your apt. Thanks so much & also can i get your number so i can call you for more dtailsThanks Im trveling with my family 4 adults 2 kids", , ,,,,,,1,
like to check out feb 13,1,,,,,,,,
"I would like to rent the two bedroom home, but i have 6 person, can you provide extra single bed?",1,,,1,,,,,
"Dear Alvin, i want to ask is it possible if i rent this unit on 18 july until 25 july?And i pay this in Rupiah or in SGD?",1,1,,,,,,,
Your listing is under a 3 bedroom listing but your description states it is a 2 bedroom and there is also no other pictures other then the master bedroom. Also explain your bed layout in each bedroom. Thank you. (AT236), ,,,,1,,,,
"SIR, WE ARE PLANNING GOA IN MAYPLS SEND ME RENT DETAILS",,1,,,,,,,
"I am booking for my brother in law from China, he and his wife (mid 60 both) spend holiday in Singapore. would like to view the place first before we commit to you. can ? thanks Philip Yu can contace me$98363167",1,,,,,,,,
"Hi po good day !!I am Victorie and I'm looking a place to stay for me and my family during our church annual gathering that would be held in SMX from December 21 to 24, 2016 and I saw your advisement for your condo unit. I just wanted to know if is there any restrictions for this advertisement like the maximum person that can stay in your unit, DO's and DON'T's, etc.Here is my mobile number +-- ---- ---- in case you need it and for faster communication. I am looking forward for your response. Thank you very much. Godbless.", ,,,,1,,,1,
"Hello good day, I am interested in booking this place. Is it easy to get a taxi around this area?",1,,1,,,,,,
hiwe are planning to visit kyoto from 27 to 29 oct and would very much like to stay in your apartment! please can you confirm it is available on these dates.Kind regardsAntonia,1,,,,,,,,
Hi! We are thinking of coming to Bali from October 31st to November 7th or maybe 8th. Just want to make sure the house is still available for those dates. Also just wondering how far the drive is from the airport?,1,,1,,,,,,
"Greetings. I would like to know if the apartment in Hamoshava is available Nov. 18-26 for my wife and myself. Is there parking available? How far is (walking) from my father - Rechov Beruriya 11?Thank you.kol tuv,Samuel Kosofsky",1,,1,,,,,,
"Hi , i just wanna ask if u charge kids as well since we will be travelling as 5 adults and 3 kids ages 2-5-6. Hope to hear from u. Thank You",,1,,,,,,,
"Hi, my friend and I are planing a 6days 5 nights trip in Tokyo and wonder if there's room available from 30th Dec to 4Th Jan. We are clean, tidy, friendly young people. Please kindly reply, thanks",1,,,,,,,,
"Dear host , we are 2 guests planning to stay in singapore, we've been trying to book your APT through travel mob, tried several times but cannot proceed, is there any other options to contact with you and proceed the booking? Thank you Ganchimeg", ,,,,,,,1,
Dear Sir.I would like to hear if we can rent the house.We are travel agency.. but its to our own family. - we make business in Dubai already. looking forward to hear from you.kindly charlotte,1,,,,,,,,
corporate requirement,,,,,,,,,1
hi! im rach and interested to rent on may 30- june 6 it is my first time in singapore i just want to know the direction to get there from airportand ill if the kitchen is a common area or not and do u have a stovethank you,1,,1,,,,,,
I have 7 adult with 2 children and 2 infant.could you please send me your contact no please.,,,,,,,,1,
"Dear Ketan, I am interested in booking the Delhi Apartment listed as Affordable and the best house, priced at 1,416 rupees per night for 3 guests.Is the apartment available from October 13th to October +-- ---- ---- (3 Nights)?Thank YouBecky",1,,,,,,,,
Would it be possible to see the home prior to us making the reservation?,,,,,1,,,,
Hi There. My husband and I will be in London for a conference and are looking at a place to rent after the conference. Your place looks great but we would want to know if it's near a tube station or a bus stop since we will be having luggage with us., ,,1,,,,,,
"Hello,There are three of us on a three week holiday to japan with one week in Kyoto and two weeks in Tokyo 3rd April - 23 April. I would be interested in booking this property for our two weeks in Tokyo (10/04/16 - 23/04/15). Just want to verify it will be available to book (it says on the page, not yet available) and what details etc you will require on booking (passport scans etc).Look forward to hearing from you.Many thanks,Oliver",1,,,,,,,,
"Hello Gennady! Tomorrow I will be in Moscow and I need a flat for some days. I see your price and I agree. If you are a good Host and simply good man. I have no much time to choose another flats because I will be in Moscow tomorrow. Help me please, if you are here. P.S. Do you have another photos of your flat? Thank you.",1,,,,1,,,,
"Hello, I am looking for an apartment for my two colleagues and I am interested in your apartment in Makati. Could you possibly give us a good rate per month? Thank you, Kathryn", , ,,,,,1,,
"HI,We are group of 10 people i.e. 5 adults and 5 children..Was looking for a villa option to accomodate us all economically. only preference is to be at the beach side/viewplease suggest.RegardsNamrata", ,,1,,,,,,
"HI! I am wondering with our vacation time frame, if spring break is at same time over there? (maybe can you tell me when spring break is over there also?) I have a 2yr old with a lot of sensory issues and other young children...and we need to be sure of no crazy parties and if this home is a walk to the beach? my son dosent handle car rides well. we really need this to work...its been hard family times here..thanks,Heather :)", ,,1,,1,,,,
"HI there,Just wanting to check availability for the weekend.Small group of us heading over to Sydney for the weekend. Basically looking for somewhere to sleep as we have a full on weekend planned around Sydney and are wanting to stay away from hotels and hostels. Please let me know how that weekend looks for you and look forward to hearing from you soon.Labroye",1,,,,,,,,
Details requested.. How far from beach? And all details related to facilities,,,,1,,,,,
"Do this apartment have a tv? i am looking at the pictures but I do not see a tv,",1,,,,,,,,
"Hey, we r looking for 10/19~24 please kindly check if there's room available. Thank you",1,,,,,,,,
"Good afternoon,I emailed yesterday asking about your availability for Dec 24-27. I really need to know as soon as possible if your home is available. I found another potential listing for us but we really prefer yours. I need to let them know by 5pm (4pm CST) if I'm taking their apartment.Thanks,Amy Emanuel",1,,,,,,,,
"Hi, may I know is the unit available from 29th-30th Aug?",1,,,,,,,,
Hi could you quote please on above dates if available.,,1,,,,,,,
"HiI would like to rent tid appartment from tommorow, its that posible. You can contact me at +-- ---- ----. Thank you.",1,,,,,,,,
Hey this is a shared pool right ? We'll be arriving in Goa at 620am .. Is it possible to check in by 7am ?,,,,,1,,,,
Good day!Is the room available on Aug 7-9 for two people? We are for short term rent only,1,,,,,,,,
"Hi,Didnt get any response on my previous inquiry.Is the unit available during the period?Regards, Andreas",1,,,,,,,,
