Message,Availability,Payment,Attraction (Experiences),Facility,House Rules,Location,Discount,Contact Host,Others
"Hi, I'm planning to have a small gathering with my friends for my birthday. Is November 7th available?",1,,,,,,,,
Hello!Very interested in staying in your beautiful apartment. My wife and I would be staying in your room for 4 nights. We are from Canada coming to visit friends in Kushiro!We would love to stay here. Please accept our request!Thank you!,1,,,,,,,,
How much is far from dehradun railway station?,,,,,,1,,,
"Hello,Could you confirm the total price for these dates for 2 adults and two children?Thank you,Bianca",,1,,,,,,,
I am interested in booking your place. Is it available on my travel dates?,1,,,,,,,,
My husband & I will be visiting our daughter on our first trip to Australia in December. Would you please verify the availability of this property from 12/30-1/2 & the rate?Thank you!Linda Rose,1,1,,,,,,,
I am in Hong Kong. staying with friend looking for somewhere to stay for few months.,,,,,,,,,1
"Hi,My wife and I are from Australia visiting our son who is studying in Boston. We will be in NY 21Oct -27Oct checking out on the 27th. We are aged 60 and 55 quiet non smoker non drinking in the apartment. We are looking for an apartment that has private bath room and small kitchen to prepare simple meals. Your accommodation look very nice. Please advise if it is available and anything else we need to know or provide.Best Wishes,Keith and Hong Griffiths,Sydney Australia",1,,,1,,,,,
Hi! How can I contract you to ask more info? Do you have line or mobile no?,,,,,,,,1,
"Good morning,I would like to know if your house is still available from March 6-15.Thank youClaude",1,,,,,,,,
"Hi Chwee. How does refundable deposits handle? Is payment through credit card including refundable deposits? I think the room is equip with kitchen but can you confirm? Also, I'm looking at check in at 1:00 am, is that Philippine time? Thanks.",,,,1,1,,,,
"Hai KaixiangMy name Rosmirizal from AmpangIm interested about your apartment. Can i booked for 2 night @ 11/3 -13/3? I will attend CPR course at penang on 12th mac. If available, how about car park, and others?",1,,,1,,,,,
Ppz inform if awailable for 25 and 26 dec,1,,,,,,,,
21 pax; 13 adult and 8 kids (4family),,,,,,,,,1
Hello is this property available for the dates above for that price,1,1,,,,,,,
"Good morning! My name is Kristy. We are from Chicago, IL in the USA although live in Al-Jubail, Saudi Arabia. My children (13, 12, 9, 5, 3) are off from school on Feb. 12-15 and my dad is visiting from the states. My husband and I would like to bring our children and father to Dubai for a few days. Do you have availibility during that time?",1,,,,,,,,
"Hi there, I was wanting to make an booking enquiry re your apartment. I was wondering if we could make the booking and pay a deposit this week and pay the rest on 16th February. We are in the middle of moving house so just paying all the rent in advance, bond and moving costs etc, which takes a toll on cash flow.Thanks for your consideration. Regards, Sherelle Torrey",,,,,,,,,1
"Hello,we would like to know if your place is available for 8 people on Jan +-- ---- ---- to 25 Jan 2016",1,,,,,,,,
"Good day! I would like to inquire if your unit is available for Nov 11 to 13? I need 2 rooms because i have 2 male guests. Can you confirm the location is it near to all, bcoz they will attend meeting in Wanchai and Central area... I hope to receive feedback from you because we normally need a unit for our guests. rEgards, Icey",1,,1,,,,,,
good am. i would like to inquire about your apartment.. 4 adult n 2 kids,,,,,,,,,1
"Hi there,Can you tell me if the bed is a ""real"" double bed for two people? Or is this a semi double bed? If you have approximate dimensions could you send them, please? Also, is all linen included (towels, sheets)? Are there any other costs to stay besides cleaning?Thank you.Kind regards,Anne",,1,,1,,,,,
"Hi Mr Koo,I'm Farhan. I'd like to rent the resort bungalow at A'Famosa from 1-2 January 2016. Is it still available. Please reply. Tq",1,,,,,,,,
"hi,is this apartment need to share living room,kitchen?thanks",,,,1,,,,,
"Hello,my name is Neil,myself and partner along with our 6 year old daughter are interested in your apartment for our visit to Sydney ,can you let me know if it's available? If so what would the cost be?Look forward to your replyNeil",1,1,,,,,,,
"Hi Babak, i would like to rent this Luxury Condo. Is it available to rent on 16 April and check out on 17 April. Hope to hear from You soon.",1,,,,,,,,
Would you be open to a 3 night stay? checkout on 11/16,1,,,,,,,,
Hello- would you be willing to rent this to us for 5 nights?,1,,,,,,,,
"COULD YOU PLEASE HELP ME CHECK AVAILABILITY ON THESE DATE DEC29-JAN2? I JUST WENT ON ------- AND IT SAID NOT AVAILABLE. IF THERE IS NO PROBLEM, IM GONNA BOOK HERE. THANKS :D",1,,,,,,,,
"Hi,I just wanted to get basic info on availability. We are a 5-person family from Poland plus a young couple (oldest daughter with boyfriend) and we are interested in getting two rooms (5 of us in one of them). The dates are still approximate. Generally, we travel for leisure & relaxation, spa, yoga, some non-intensive watersports (sailing?), vegetarian cuisine, maybe few short trips in the area. Please let know about the availability and suitability of the area for us (easy access to the Mandrem beach with the kids), transfer from Pernem Railway st. and the total charge for such a stay.Greets from Poland,Cyprian",1,,1,,,1,,,
hi how much will cost me for 2 night and where it is locationed at damansara,,1,1,,,,,,
"Hi Kim,I am looking around for a entire apartment for 5 persons, my friend's family, to stay up for 6 days in SG for their visit.We are quite comfortable with your apartment listing and I would like to know if there are something we need to know before booking.Thanks and Regards,Zin Min",,,,,,,,,1
"Hi -I just submitted a request to book your place. Credit card under Anthony Falcetti. We are looking to stay tomorrow (Tue 7/21). The confirmation says it will take 2 days to confirm, which would be after our stay. Wondering if you are able to let us know if it is available? Thanks, Tracy",,,,,,,,,1
Hi Carmen!! Sorry if you have gotten this a couple times!!New dates May23-27... And a quick question--If 3 people leave on the 25th will be less on the last 2 nights??Thanks Tiffany,,,,,,,1,,
"Hi Lim,I'm planning to stay at your homestay for 2 nights (5/12/2015 - 7/12/2015). I will be coming down to Penang for work this Friday 6/11/2015. I would like to view the homestay before I decide. Are you available to show me the place on that day?Say after lunch around 2-3pm on 6/11/2015?",,,,,,,,1,
"Hi, we are a family of 5 adults. Like to stay in your apartment for 4 nights. Only our airplane arrives at aroud 22;30. Is it possible to check in after midnight? And how do you charge for airport pick up for 5 adults with about 8-9 luggages? Thank you ! Joyce Wei",,,,,1,,,,1
Hi Nguyen. Good day. I'm a businessman from Malaysia.I'm here with my family of 8. I'm leaving from Ho chi minh today and I need a house to stay for 5 days. Is there any availability ? please contact me at +-- ---- ----. thank you so much.,1,,,,,,,,
"Hi Yue, I'm interested in your rooms, but I need a room from 31st Jan to 29th Feb. Do you have any this 30 days available room?",1,,,,,,,,
"hello rasheed, i am travelling to colombo with my wife and her parents this december. we wil be staying there for 42 days. please let me know if you can arrange our stay in this apartment.Regards, Rizwan +-- ---- ----",1,,,,,,,,
Hi..Few guests are coming for one family -------.--- need to accomodate them at one place.,,,,,,,,,1
"Hi Jason, Sid Katz is my travel partner. Yesterday we booked your apartment!!! We decided to change our dates and check out a day early so we could stay at your place (2 Bdrm Open Kitchen). I very much hope this work for you and we are able to confirm our booking. Thanks so much for all your help. Best regards, Victoria",,,,,,,,,1
"hi, im Michelle, from Philippines. we would like to stay in HK for 3days and 2nights, mainly to visit Disneyland and Ocean Park. Im looking for apartment to stay-in, and can fit 6-adults and 4-children (11y/o, 2 7y/o & 2y/o). expected check-in is 12pm.",1,,,1,1,,,,
"Hi Leopoldo we will be flying in from nj to visit my son, his wife and our one yr old granddaughter with our other son and our little yorkie, louie with louie, we have stayed at the viceroy--is your balcony a water view?? and I am so impressed with the little childrens play area. thankyou, Maryann",,,,1,,,,,
"Hello,We are an older couple visiting our daughter in Jerusalem.She lives in a one room apartment and we are looking to stay close by. We were wondering if we could rent your apartment either from the 20th to the 24th of October or from the 21st to the 24th of October. Thanks. Isa",1,,,,,,,,
I also want car or bike on rent and you also prefer me good beach for young boys and also want to go at cruiser party,,,1,1,,,,,
"Hi Steve,Is your villa available on 2nd september to 5th september. or if you have 2 bedrooms villa for 2 couples. i will await for your reply. Thank you.Best,Austin",1,,,,,,,,
Do U have park free?,,,,1,,,,,
HiHow much is your charge for the above dates.....or for a month....your best rate. ThanksRegardsLayla and khalid,,1,,,,,,,
can u pick me in the airport?,,,,,,,,,1
Good day We are a mature couple from Cape Town South Africa. We are planning a trip to Vietnam in December 2015. We are looking for central apartment in Hanoi.Do you have availability and what is the price? Regards Johann,1,1,,,,,,,
"Hi, I want to come here for sunburn, please let me know if smoking is allowed in the room and the exact location and how far it is from the vagator. thanks!",,,,,1,1,,,
HiWe are a family of 3 adults travelling together. Wondering if there is a separate bedroom in your apartment - and where the 3rd person can sleep? Is the couch a pull out?Many thanksMalcolm Hinton,,,,1,,,,,
"Dear Mrs. GreciaWe are from Costa Rica, but we work in Qatar. We want to rent the villa from Dec 30 to Jan 5 is available?Waiting for your response to bookMy phone is +-- ---- ----",1,,,,,,,1,
I need one apartament for to people.we will come in the 3 August.I want reserved one apartament for monday my nr for contact +-- ---- ----,1,,,,,,,1,
"Hi, I am wondering if the date mentioned above is available?ThanksJames +-- ---- ----",1,,,,,,,,
"Hi, interested in your apartment and can you confirm if the date above is available?",1,,,,,,,,
"Hello. We will be in Prague around the new year. Is your place located near public transportation? How long does it take to reach your place from the train station if we are coming in by train from Vienna -> Prague? Also, do you think 6 days is a good length of time in Prague?",,,,,,1,,,
Hi can you tell me if your apartment is available in 15feb til 21 February and how much will it cost for a family of 8 and 2 children Thank you Z miah,1,1,,,,,,,
I am interested in booking your place. Is it available on my travel dates?,1,,,,,,,,
"Hi,Good day!Me and my fiance plan to go to SG on November to attend a conference in Furama Riverfront. We plan to stay for 5 nights. Is this place near Furama, if not, is Furama easily accessible from this place?Also, since it says on the ad. that this is a private bedroom rental, will there be other people with us during our stay in the condo?Thank you!Kind regards,Adrian",,,,1,,1,,,
"hii love the apartment, but its above my budgetcan you offer a better rate please?",,,,,,,1,,
"I see your post saying $63 a night, is it the price on 1/15-18 total 3 nights",,1,,,,,,,
"My husband and I and another couple are planning to visit Istanbul May 14 - 19, 2016. We are interested in renting your apartment.We are wondering how long you have been renting this property. The absence of reviews is somewhat concerning. We frequently rent VRBO properties and always consult the reviews before booking.As this will be our first time in Istanbul, are you able to assist us with arranging transportation from the airport to the apartment?Looking forward to your reply.",,,,,,,,,1
Hello my husband and I live in Scotland. We are in our sixties and want to spend a couple of months in self catering accommodation near to Bondi beach. We are non smokers and pet free. We would specially like BBQ facilities. We will not Be driving. We have flights booked from Edinburgh leaving 26th November returning on 20th January. Please let us have a price if available and maybe longer stay discount. Many thanks. Linda Lindsay,,1,1,1,,,,,
We are my husband and I for 12 nights total.,,,,,,,,,1
Hi. Can i know any charge for extra ppl and the room suit for how many person to stay?,,1,,1,,,,,
any available ?,1,,,,,,,,
"Hi, we are young couple from Taiwan, may I ask how many person share the bathroom, living room and kitchen? How many room inside the house? This room is a privacy room for 2 person, is that correct? Or need to share the room with any other person? Thank you~",,,,1,,,,,1
"Hi Raj,Came across your listing and found it good enough. As i am travelling to Goa on 16th of Feb, i am in need of apartment like you have listed. Can you please communicate more on the rent and other things this apartment has. You can reach me on my number +-- ---- ----. Thanks",,1,,,,,,1,
Hi I am keen on leasing your condo for 1 night on the above date. Is it available on that day?,1,,,,,,,,
"Hi Li, I'm a Singaporean looking for accommodation for around 15-16 guests coming from overseas to attend a wedding during this time window in Jan. Is it possible to arrange for a viewing with you? Thank you! -Husena (+-- ---- ----)",,,,,,,,1,
"Hello,I'm interested in some more information about this property. I am unfamiliar with the area and wanting to know if this is a good location to see all the main sites? Also is this property private and in a safe area?Thank you!",,,,1,,1,,,
"Hi,We are 3 Adults Visiting Goa from Indore and looking for accommodation for above dates, please let me know if your apartment is available and can be reserved for us. you can contact me on +-- ---- ---- OR let me know your no.RegardsChirag Khandelwal",1,,,,,,,,
I HAVE A COUPLE WANT TO RENT FOR 12 DAYS IS IT AVAILABLE I AM A REALTOR THEY R FAMILY,1,,,,,,,,
"is this for rent monthly? how much per month? kindly contact me on +-- ---- ----, This is for long terms rent. or at -----@-----.---",1,1,,,,,,1,
"hv family vacation in melaka. 3 couple, father mother daughter n son in law.... 1 day trip only",,,,,,,,,1
"Hello, I am in dubai for 2 months maybe longer, how much is a monthly rental for the apartment?",,1,,,,,,,
Dear Sir we are a family (4 adults) and we are looking for an accomodation for 6 nights in Tokyo. Do you have availability for the mentionated dates from 7 to 13 September 2015? What will be the rate all included? Many thanks for your kind attention best regards,1,1,,,,,,,1
"Hey hii,we are to visit goa on 4th of september , me along with 2 of my friends are going , i liked your property and would like to book the same for mentioned date if the same is available, please provide your contact no. so we can contact you directly , and would like to mention we in a group of 3 so if that is ok with you Pinaak Mishra+-- ---- ----",1,,,,,,,1,
"Hello, I would like to change the dates to +-- ---- ----.1 if you that is alright.",,,,,,,,,1
"Hi, good day to you, Judith and Donald. This is Kit Dungca and I am from the Philippines. I am planning to bring my family (5 kids) to Singapore for the New Year (Dec 27-Jan 3), but I noticed that these dates are blocked off in the drop down menu? If we choose another date, what would be your recommendation for us (kids are 20. 18. 16, 13 and 11)? Hope to hear from you. Thank you and God bless!",,,,,,,,,1
"Hi,I'm interested in renting out your property for the dates of 4/15 - 4/18. If these dates are available please let me know at your earliest convenience. Thanks",1,,,,,,,,
Hi I'm looking for the rooms good for 7paxs..I need at September 16-19.thank u,1,,,,,,,,
"Looking for a place to sleep 8 people. there are 2 couples, 2 girls that can sleep together and another girl and boy that need separate beds. We would like a dining table that seats 8. A/C in each room would be ideal. Our budget is $650 Australian per night. If this place is not available please advise if you have others that suit our requirements. Very many thanks. Kerry",,1,,1,,,,,
"Hi again,Me and my boyfriend needs a place to stay from January 2-4. Is your unit available on these dates?Thanks.Regards,Michelle",1,,,,,,,,
"Hello,I am bringing my family to Melbourne for the Edinburgh Tattoo and we are looking for some accommodation.i have just discovered Travel Mob and your apartment sounds wonderful and the price is very good with parking included for our car.I was wondering if it's possible to sleep 4?2 Adults and 2 Small children? We are not worried whether someone has to sleep on the floor or some cushions for the location and the price is wonderful, I could even put a mattress in the car and bring it with us .We are regular campers so are used to roughing it when we have to.Thank you for your consideration.Bec Clarke",,,,1,,,,,1
is the house still available? :),1,,,,,,,,
Family of 3 (husband + wife and 2.5 years old kid. Looking forward to book apartment from 16th July to 23 rd July. Kindly confirm for the dates so as to book. Thanks!!!,,,,,,,,,1
Hi! I'm looking for a private room for one month and interested in ur ad. Is it possible to see today?,1,,,,,,,,1
"Hi Tenko.....my name is -------.--- from -------.--- thinking of visiting Tokyo, in November. Is your place a very central location? Is it near shinjuku area? Any metro station nearby? Is it easy to get to yr apartment from hotel? Is it very difficult getting around Tokyo if you don't know Japanese or Chinese? Thank you.",,,1,,,1,,,1
Is this unit available for the days listed above?,1,,,,,,,,
"I'm planning to travel to tokyo during March30-April4,2016 for 5 nights with my family of 6 people. : me and my husband, 2 children and my parents. I'm trying to find a place that not far from shibuya station. Is your place are still available and can accomadate for 6 of us?? Pim",1,,,,,1,,,
"Greetings of the day. Dear Raymond. My name is Konstantin. I am working for a VIP Family. I would like to consider this property for their next stay in Dubai. I would like to discuss details about this specific property.You are welcome to contact me via Phone +-- ---- ----Hope to hear from you soon.We dont have the dates yet but their stays are usually long between 20-30 daysBest Regards,Konstantin",,,,,,,,1,
"Hej,We are three friends visiting philipines for first time for one month, I and my friend are Petroleum engineers, working offshore around the globe, we are from Denmark and Sweden.We will start with Manila for one week then continue to Cebu and Burakay after.We are mid fifty, so we do not like noise either.Would it be possible to take us from airport?About the SUV and driver, would you tell more about this arrangment and how much will it cost please?best regards",,1,,,,,,,1
hi. is this villa free for these 6 days? regards Anna,1,,,,,,,,
Hi! Me and my friends are really interested in booking your apartment for the abovementioned dates.I have a question though: is a later check out possible? Our flight out of the country is at night.,1,,,,1,,,,
Hello!I'm looking for villa for my clients. I'd like to confirm your villa is available following dates. Thank you!,1,,,,,,,,
what would the price be all inclusive for the five nights?,,1,,,,,,,
Is the room available between Aug 9 - 13?,1,,,,,,,,
hello we are koreancan we reservate your room??D,1,,,,,,,,
"Hello Stephaniewe are looking at coming to Melbourne for a short break.checking in on Wed 30th Sept, and check out Monday 5th Oct, on the website it says that your accommodation is available.do we need any miticket public transport tickets to travel the trams into the city. we know we can get the skybus form the airport to Spencer St, and then we could get the tram from thereregardsMarien",,,,,,,,,1
Helo. Just wat to inquire if this is still available from April 3-4. 1day overnight stay only.,1,,,,,,,,
"Hi David,My husband and I are an active retired couple from Ireland visiting our family in Australia for 3 months. We don't want to outstay our welcome with them and would like to spend a month in Melbourne before returning to them for Christmas. Your place looks like a great location. My only query is why, if it is a double room and quoted as such, you have to pay for an extra guest, thus putting up the cost by a lot? (We are on a strict budget!). But notwithstanding that query we are really interested in staying in your lovely house and do hope it is available. Hope to hear from you soon. Best regards, Rosaleen.",1,1,,,,,,,
hello is the unit available?,1,,,,,,,,
Would your apartment be available on those dates thank you,1,,,,,,,,
"i would like to see is there any room available during 26/2-1/3?if we have 2 people, need to share room with others?",,,,,,,,,
2 packages please?,,,,,,,,,1
"We are looking for a month rental starting on December 15th. Do you have availability. Is there a monthly rate versus daily like some of the other condos/apartments have?We love visiting Tokyo and look forward to coming bs k. Greatly appreciate your reply,Ricki",1,1,,,,,,,
"Hi, does this room have windows?",,,,1,,,,,
"Hello We are a family of four from England, looking for accommodation for 5 nights with our two daughters. Emily is 9 years old and Holly is 6 years old - they are very well behaved. Alex (my husband) and I are both 41 years old. Would you be able to accommodate us? ThanksRebecca",1,,,,,,,,
Hello,,,,,,,,,1
"Hello again. Is this 2 bedroom or 3 bedroom apartment? It says both in the description.Thank you,Eileen Weinberg",,,,1,,,,,
Availability confirmation,1,,,,,,,,
"Hello,We are five guys and interested about renting your apartment from +-- ---- ----.5.2016. How much the apartment would cost? Could we pay by cash when we arrive? Is it possible to use ruble? What about refundable damage deposit, how we can have it back?How we get the keys? What is the time for checkin in and out?Is there something more that we should need to know?Best regards,Jouni",,1,,,1,,,,1
Do you have room in those time?,1,,,,,,,,
"We would like to inquire if your place is available on 19-20Dec. We are planning to stay overnight (23-24 hrs). Activities will include swimming, pool games, singing. We are also planning to do some cooking. Please advise if site is available and how much will be the cost. Thank you.",1,,,1,,,,,
"I am in the process of planning my family 2016 summer vacation and would like to receive more information regarding your rental unit, including the total price for the week and if you accept monthly payments until the full price is paid in full.Thank you,Brenda Heubel",,1,,,,,,,
"Hello , I hope you are well. My friends and I are interested in booking your home for Jan 21-24. There will be 11 of us in town for my friend's bachelorette weekend getaway. We are all professional women in our mid 30s and plan for this to be a relaxing weekend away together rather than a wild time that one might imagine a bunch of 20 year olds having in Miami.We are all very neat and would treat your home with respect as if it were our own and leave it the way we found it. We are accustomed to weekends away together because one of us has a home in Fire Island, NY so we know what is necessary to do to be good house guests.I am in the process of gathering payment from everyone to cover the cost of the home and have given guests a deadline of Dec. 11. I figured I would message you in the meantime to get acquainted so that we might book immediately as soon as the money has been collected.Please let me know if you have any questions or concerns.Kind regards, Sabia",1,,,,,,,,1
"Hello!My name is Nes. I'm from the Philippines. Me and my friends are travelling to Singapore on the dates stated above. There are four of us. We saw your listing here and we got interested. It looks like a neat apartment. We're really just looking for a place to sleep and wash. We're gonna be out the whole day going places and sight seeing.Anyway, like I said there are four of us. Can we all sleep in the apartment? I hope to hear from you soon.Thank you very much,Nes",1,,,,,,,,1
HiI am interested in renting your villa for next summer. May or June. I have been in Cyprus before; is your villa in walking distance to Capo Bay hotel and the beach?,,,1,,,1,,,
"Hello. My husband, son (17) and I are hoping to rent your lovely apartment from the evening of 12/29 through the morning of 1/2. Please let us know if it is available and how much this will be. Many thanks! Anne",1,1,,,,,,,
"Ma'am/Sir,Good day!I would like to inquire how much would it cost if we, together with my b0yfriend and my 2 kids to spend 3 weeks in your condo unit?Thank you, I am waiting for your reply.",,1,,,,,,,
Please reach me at +-- ---- ---- asap. Is this bungalow available? Whats the rate?,1,1,,,,,,,
"We want to rent your villa on this date. We have 3 family, ask you to know what price on this time.",,1,,,,,,,
Hi there just wondering if this house is avaliable for the dates that Im enquiring about and if so what is the criteria to do so. Thanking youKyra,1,,,,,,,,1
"Hi, may I know if the apt is available from 8 Jan to 12 Jan?",1,,,,,,,,
I need 4 bed apartment in JBR or Marina for 8 night for following dates 10th of November to 18th of November6 adult 4 children 2 infant child,1,,,,,,,,
I'm traveling with my husband. We are from Sarawak.,,,,,,,,,1
